Title,Author,Publisher,Description
부의 전략 수업 (돈에 휘둘리지 않고 살아남는 15가지 시스템),폴 포돌스키,필름(Feelm),"“돈은 따라가는 것이 아니라, 설계하는 것이다.”

헤지펀드의 대부 레이 달리오가 주목한
자수성가의 아이콘 폴 포돌스키
누구나 지속가능한 부를 만들 수 있는
실전적이고 명쾌한 돈의 구조, 심리, 전략의 수업

《부의 전략 수업》은 헤지펀드의 대부인 레이 달리오가 주목한 월스트리트의 새로운 자수성가 아이콘, 폴 포돌스키의 부에 관한 예리하고 실전적인 내용을 담은 책이다. 우리는 모두 부를 원하지만, 그것은 얻기 쉽지 않다. 하루가 다르게 빠르게 변화하는 세계는 투자를 불확실하게 만들고, 끊임없이 변하는 자산의 가치는 미래를 예측하기 힘들게 만든다. 그리고 이 불안은 돈이 많아질수록 오히려 더 커진다. 더 벌고 싶다는 우리의 욕망도 끝이 없고, 만족은 점점 멀어진다. 이제 문제는 돈 자체가 아니라, 돈을 대하는 우리의 태도다.
《부의 전략 수업》은 일확천금이 아닌 지속 가능한 부를 만드는 방법을 탐구한다. 돈이 우리의 삶을 어떻게 지배하는지, 그리고 우리가 어떻게 돈의 주인이 될 수 있는지를 보여준다. 단순히 돈을 버는 것을 넘어, 돈을 다루는 법과 부를 유지하는 전략을 전한다.
이 책은 재테크 기술을 넘어, 돈과 삶을 바라보는 근본적인 시각을 변화시킨다. 경제적 자유를 이루는 핵심 원리와 실전 전략을 통해, 독자는 돈에 휘둘리는 사람이 아닌 돈을 통제하는 사람이 될 수 있다.
지속 가능한 부를 원하는가? 그렇다면 이제, 돈을 보는 시선을 바꿔야 한다."
