Title,Author,Publisher,Description
오만과 편견(초판본)(1894년 오리지널 초판본 표지디자인) (1894년 오리지널 초판본 표지디자인),제인 오스틴,더스토리,"국내 최초 1894년 공작새 에디션 초판본 표지이미지  
영국이 낳은 여류작가 제인 오스틴의 연애학 개론 《오만과 편견》

이 시대 최고의 찬사를 받은 제인 오스틴의 《오만과 편견》
초판 출간 210주년을 기념해 공작새 에디션으로 다시 돌아온 사랑 이야기

영국 BBC 방송은 두 번째 밀레니엄을 마감하여 ‘지난 천년 동안의 최고의 문학가’를 뽑는 설문조사를 실시했다. 1위인 윌리엄 셰익스피어에 이어 두 번째로 이름을 올린 작가가 바로 제인 오스틴이다. 《오만과 편견》은 노벨 연구소가 선정한 세계문학 100대 작품에 선정되었으며, 호주에서는 독자가 선정한 ‘역사상 최고의 책’ 1위에 올랐다. 또한 국립중앙도서관의 청소년 권장도서 등 우리나라의 각종 추천도서 목록에도 빠지는 일이 없다. 사람들이 이토록 찬사를 보내는 이유는 ‘아무나 쓸 수 없는 제인 오스틴만의 특별함’이 작품 속에 내재되어 있기 때문이다. 《오만과 편견》은 인류의 보편적인 감성을 따르면서도 그 안에 갇히지 않았고, 소설의 묘미를 살리면서 통속적이지 않기에 사람들의 마음을 움직였고, 첫 문장부터 읽는 이를 이야기 속으로 끌어당긴다. 1894년 초판본 표지를 통해 제인 오스틴의 문학적인 감성을 직접 느껴보자.

“오만은 자신을 바라보는 관점에서 비롯된 것이고,
허영은 타인이 자신을 어떻게 봐 줬으면 하는 것이지.”_본문 중에서

그렇다면 이 소설이 전 세계적으로 사랑받고 무대에 설 수 있었던 까닭은 무엇일까. 사랑에 대한 공감이나 시대적 배경에 대한 호기심 때문만은 아닐 것이다. 이 작품이 200년이 지나도 전 세계인의 공감을 얻을 수 있었던 이유는 제인 오스틴 특유의 세밀한 포착력과, 타고난 입담 덕분이었다. 대개 걸작의 기준은 바로 ‘보편적 감성’이 좌우한다. 세계인의 마음속에 새겨진 바로 그 작품! 이제 더스토리의 《오만과 편견》 스페셜 에디션을 읽으며 210년 전에 창조된 걸작의 진한 향기에 흠뻑 취해 보자."
