Title,Author,Publisher,Description
침묵하라 그리고 말하라,법정,열림원,"“침묵은 인간이 자기 자신이 되는 길이다.
말은 비우고 마음을 담아라.”
빛의 예술로 새기는 법정 스님 무소유 진리의 정수
세계적인 거장 ‘빛의 화가’ 김인중 신부의 미발표 작품 수록

부처님 오신 날을 맞아, 우리 시대 마지막 큰 어른으로 불렸던 법정 스님의 글을 엮은『침묵하라 그리고 말하라』가 출간됐다. 이 책은 세월을 뛰어넘어 여전히 깊은 울림을 전하는 법정 스님의 글 중 일부를 엄선해 담아낸 것으로, 말의 과잉과 소음 속에서 살아가는 현대인들에게 묵직한 메시지를 건넨다.
『침묵하라 그리고 말하라』에서 말하는 ‘침묵’은 단순히 말수를 줄이는 차원을 넘어선다. 법정 스님은 “침묵은 인간이 자기 자신이 되는 길”이라고 말하며, 침묵을 통해 말의 무게를 되새기고 타인과의 관계 속에서 진실에 다가갈 수 있다고 강조한다. 법정 스님은 이러한 침묵의 태도와 맞닿아 있는 삶의 자세로 ‘단순함’을 강조하며, 비움과 절제를 통해 진정한 풍요를 일구는 길이라 말한다. 그리고 자연은 말없이 존재함으로써, 인간에게 삶의 본질을 일깨워주는 고요한 스승이라 여긴다.
이번 책에는 ‘빛의 화가’로 불리는 세계적인 예술가 김인중 신부의 미공개 작품 30여 점이 실려 있다. 그는 법정 스님의 정신에 깊이 공감하며, 그 뜻을 담아 정성껏 작품을 선별하고 작업에 참여했다. 작품마다 물질문명 속에 감춰진 고요와 생명의 흐름, 내면의 빛이 담겨 있어, 법정 스님의 글과 깊은 공명을 이룬다. 예술과 명상이 만나는 이 책은 우리에게 단순한 독서를 넘어, 영혼을 어루만지는 치유의 시간을 전해줄 것이다.
『침묵하라 그리고 말하라』는 단순한 명상서에 그치지 않는다. 진정성과 소박함을 추구하는 이들에게 깊은 통찰을 건네며, ‘말없이 정진하는 태도’를 통해 정신적인 가치와 참된 행복을 되찾도록 이끈다. 영성을 회복하고 진실한 삶을 향해 나아가는 여정 속에서, 법정 스님의 메시지와 김인중 신부의 작품은 우리의 깊은 내면을 은은히 비춰줄 것이다."
